{
  "cluster_id": "9c5f8a55-06f2-4f2b-bd95-0d2b9d14b0c4",
  "version": "1.0.0",
  "name": "Aegis Cluster 17 â€” Research & Analysis",
  "status": "active",
  "steward": {
    "steward_id": "steward-17",
    "display_name": "Cluster Steward 17",
    "contact": {
      "channel": "slack",
      "address": "#aegis-cluster-17"
    },
    "auth_level": "standard"
  },
  "members": {
    "member_count": 18
  },
  "capabilities": {
    "tags": ["research", "analysis", "writing"],
    "tooling": ["google_docs", "github", "notion"],
    "domain_focus": ["security", "ai_governance", "threat_intelligence"]
  },
  "capacity": {
    "availability_status": "available",
    "max_concurrent_tasks": 3,
    "max_weekly_task_load": 10,
    "timezone": "America/Chicago",
    "hours_of_operation": {
      "start_local": "09:00",
      "end_local": "17:00"
    }
  },
  "consent_policy": {
    "requires_explicit_acceptance": true,
    "refusal_is_penalty_free": true,
    "acceptance_method": "steward_accepts",
    "task_types_allowed": [
      "research_summary",
      "testing_validation",
      "content_creation"
    ],
    "sensitive_task_gate": {
      "enabled": true,
      "requires_steward_auth_level": "sensitive"
    }
  },
  "interfaces": {
    "intake_channels": ["web_portal", "slack"],
    "delivery_channels": ["web_portal", "slack", "email"]
  },
  "audit": {
    "created_at": "2026-01-15T22:00:00Z",
    "updated_at": "2026-01-15T22:00:00Z",
    "audit_level": "standard",
    "event_log_enabled": true,
    "data_retention_days": 365
  }
}
